{
  "role": "police",
  "own_position": [0, 0],
  "step_number": 1,
  "public_barriers": [],
  "belief_heatmap": [
    "0.250000000000",
    "0.250000000000",
    "0.250000000000",
    "0.250000000000"
  ],
  "belief_entropy_bits": 2.0,
  "belief_peak_probability": 0.25,
  "credible_region": [[0, 0], [0, 1], [1, 0], [1, 1]],
  "most_likely_cell_diagnostic": [0, 0]
}
